{"pageProps":{"frontmatter":{"author":"Erika Funa","date":"2024-10-23","draft":false,"title":"Luxembourgish Teachers Experiment with Orange in Nature","url":"Orange-Luxembourg-nature","thumbImage":"DB3b.png","frontPageImage":"DB3b.png","blog":["data","analysis","Luxembourg","teachers","Orange","experiment"],"shortExcerpt":"How can Orange support the needs of teachers and children in the pedagogical process? In Luxembourg, Blaž Zupan and Janez Demšar carried out an experimental workshop with local primary school teachers to test some approaches.","longExcerpt":"How can Orange support the needs of teachers and children in the pedagogical process? In Luxembourg, Blaž Zupan and Janez Demšar carried out an experimental workshop with six local primary school teachers to test some approaches. The leaf-teamed session started in the wild and concluded with an interactive reflection and evaluation session."},"content":{"compiledSource":"/*@jsxRuntime automatic @jsxImportSource react*/\nconst {Fragment: _Fragment, jsx: _jsx, jsxs: _jsxs} = arguments[0];\nconst {useMDXComponents: _provideComponents} = arguments[0];\nfunction _createMdxContent(props) {\n  const _components = Object.assign({\n    p: \"p\",\n    a: \"a\",\n    img: \"img\"\n  }, _provideComponents(), props.components);\n  return _jsxs(_Fragment, {\n    children: [_jsx(_components.p, {\n      children: \"How do we harness children's curiosity about the world and society we live in, with data in its different forms, while also encouraging critical thinking and reflection?\"\n    }), \"\\n\", _jsxs(_components.p, {\n      children: [\"The aim of the \", _jsx(_components.a, {\n        href: \"https://www.dali4us.eu/\",\n        children: \"DALI4US\"\n      }), \" project is not to train data scientists, but to equip primary school teachers with the skills, knowledge, confidence, and enthusiasm to bring data exploration into upper primary schools in Ireland, Luxembourg, and Slovenia. With some insightful experimental teacher training sessions behind us, the how of the next steps was at the center of our discussions in the project meeting in Luxembourg.\"]\n    }), \"\\n\", _jsx(_components.img, {\n      src: \"/blog/2024-10-DALI4US-Luksemburg/__optimized-images__/DB3a.png\",\n      alt: \"\",\n      width: \"4284\",\n      height: \"5712\"\n    }), \"\\n\", _jsx(_components.p, {\n      children: \"The most effective toolset that can support data literacy development through data exploration is Orange, whose huge advantage is that it doesn't require the user to be trained in computer science or statistics. We are currently adapting it to best support the needs of teachers and children in the pedagogical process, and we already have some ideas of what that might look like, starting by creating a web version!\"\n    }), \"\\n\", _jsx(_components.p, {\n      children: \"In Luxembourg, Blaž Zupan and Janez Demšar from the University of Ljubljana, Faculty of Computer and Information Science also already carried out an experimental workshop with six local primary school teachers! The session started in the wild, with a walk in the woods, where we collected different types of tree leaves. After the crisp but energising walk, we grouped similar leaves together, performing different levels of clustering. In the second part, we used Orange to show the teachers the technique of classification.\"\n    }), \"\\n\", _jsx(_components.img, {\n      src: \"/blog/2024-10-DALI4US-Luksemburg/__optimized-images__/DB3b.png\",\n      alt: \"\",\n      width: \"1280\",\n      height: \"960\"\n    }), \"\\n\", _jsx(_components.p, {\n      children: \"The workshop concluded with an interactive reflection and evaluation session, where the teachers discussed the potential of Orange for classroom activities. They emphasised the importance of helping students understand, interpret, and use data meaningfully in their everyday lives. The teachers also discussed the potential version of Orange that would be tailored for younger learners.\"\n    }), \"\\n\", _jsx(_components.p, {\n      children: \"We definitely got some valuable feedback and input for our next session that will take place in Ireland!\"\n    })]\n  });\n}\nfunction MDXContent(props = {}) {\n  const {wrapper: MDXLayout} = Object.assign({}, _provideComponents(), props.components);\n  return MDXLayout ? _jsx(MDXLayout, Object.assign({}, props, {\n    children: _jsx(_createMdxContent, props)\n  })) : _createMdxContent(props);\n}\nreturn {\n  default: MDXContent\n};\n","frontmatter":{},"scope":{}},"thumbImage":{"width":1280,"height":960,"src":"/blog/2024-10-DALI4US-Luksemburg/__optimized-images__/DB3b.png"}},"__N_SSG":true}